{
  "$schema": "../../schema/proficiency-bonus.schema.json",
  "id": "proficiency-bonus",
  "source": {
    "book": "Livro do Jogador 2024",
    "language": "pt-BR",
    "chapter": 1,
    "pdfPath": "doc/livro-jogador.pdf",
    "pdfPages": [19, 19]
  },
  "description": "Todas as criaturas possuem um Bônus de Proficiência. Para personagens, o bônus aumenta conforme o nível (ver também character-advancement.json).",
  "byLevelOrCR": [
    { "levelMin": 1, "levelMax": 4, "bonus": 2 },
    { "levelMin": 5, "levelMax": 8, "bonus": 3 },
    { "levelMin": 9, "levelMax": 12, "bonus": 4 },
    { "levelMin": 13, "levelMax": 16, "bonus": 5 },
    { "levelMin": 17, "levelMax": 20, "bonus": 6 }
  ],
  "byChallengeRating": [
    { "crMin": 0, "crMax": 4, "bonus": 2 },
    { "crMin": 5, "crMax": 8, "bonus": 3 },
    { "crMin": 9, "crMax": 12, "bonus": 4 },
    { "crMin": 13, "crMax": 16, "bonus": 5 },
    { "crMin": 17, "crMax": 20, "bonus": 6 },
    { "crMin": 21, "crMax": 24, "bonus": 7 },
    { "crMin": 25, "crMax": 28, "bonus": 8 },
    { "crMin": 29, "crMax": 30, "bonus": 9 }
  ],
  "doesNotStack": true
}
